question,answer
"What is a cloud-based SaaS chat solution?","A cloud-based SaaS chat solution is a software service that enables businesses to communicate with their customers in real-time through web-based chat interfaces, without the need for on-premises infrastructure."
"How does live chat benefit SaaS companies?","Live chat benefits SaaS companies by providing instant customer support, increasing customer satisfaction, reducing response times, improving conversion rates, and gathering valuable customer insights."
"who is ashiq?","Ashiq is jinn"
"What are the key features of a good cloud chat SaaS solution?","Key features include real-time messaging, chatbots, multi-channel support, analytics, customization options, integrations with other tools, file sharing, and mobile compatibility."
"How does cloud-based chat differ from on-premises chat solutions?","Cloud-based chat solutions are hosted and maintained by the provider, offering easier scalability, automatic updates, lower upfront costs, and accessibility from anywhere, unlike on-premises solutions which require local installation and maintenance."
"What security measures should a cloud chat SaaS solution implement?","Security measures should include end-to-end encryption, secure data storage, regular security audits, compliance with industry standards (e.g., GDPR, HIPAA), multi-factor authentication, and role-based access control."
"How can AI be integrated into cloud chat solutions?","AI can be integrated through chatbots for handling routine queries, sentiment analysis for understanding customer emotions, predictive typing for faster agent responses, and automated routing of chats to the most suitable agent."
"What are the pricing models typically used for cloud chat SaaS solutions?","Common pricing models include per-user pricing, tiered pricing based on features, usage-based pricing (e.g., number of chats), and hybrid models combining fixed and variable costs."
"How does a cloud chat solution support multi-channel communication?","Multi-channel support allows integration with various platforms like websites, mobile apps, social media, and messaging apps, providing a unified interface for agents to manage conversations across all channels."
"What types of analytics should a cloud chat SaaS solution provide?","Analytics should include metrics like chat volume, response times, customer satisfaction scores, agent performance, conversion rates, popular topics, and peak usage times."
"How can cloud chat solutions integrate with CRM systems?","Integration with CRM systems allows for automatic population of customer information, logging of chat transcripts, creation of support tickets, and syncing of customer interaction history across platforms."
"What are the benefits of using chatbots in a cloud chat solution?","Chatbots can handle routine queries 24/7, reduce wait times, scale to handle high volumes of conversations, provide consistent responses, and free up human agents for more complex issues."
"How does a cloud chat solution ensure high availability and uptime?","High availability is ensured through distributed server architecture, redundant systems, load balancing, automatic failover mechanisms, and regular maintenance during off-peak hours."
"What customization options should a cloud chat SaaS solution offer?","Customization options should include branded chat widgets, personalized greetings, custom chat routing rules, adjustable auto-responses, and the ability to modify the user interface to match the company's branding."
"How can cloud chat solutions support multiple languages?","Multi-language support can be implemented through real-time translation services, language-specific routing to appropriate agents, and customizable interfaces and chatbots for different languages."
"What are the key performance indicators (KPIs) for measuring the success of a cloud chat implementation?","Important KPIs include customer satisfaction scores, first response time, average handling time, chat-to-conversion rate, number of chats handled, and resolution rate."
"How does a cloud chat solution handle peak traffic periods?","Peak traffic is managed through auto-scaling of server resources, intelligent chat routing, queue management systems, and the use of chatbots to handle increased query volumes."
"What types of file sharing capabilities should a cloud chat SaaS solution support?","File sharing capabilities should include support for various file types, secure file transfer, preview options for common formats, size limits to prevent abuse, and integration with cloud storage services."
"How can cloud chat solutions improve customer onboarding for SaaS products?","Cloud chat can improve onboarding by providing instant access to support, offering guided tours through chat interfaces, answering product-specific questions in real-time, and proactively reaching out to users who might be struggling."
"What role does machine learning play in improving cloud chat solutions over time?","Machine learning can improve chat solutions by enhancing chatbot responses, predicting customer needs, optimizing routing algorithms, identifying trends in customer queries, and personalizing interactions based on past behavior."
"How does a cloud chat SaaS solution handle data backup and recovery?","Data backup and recovery are managed through regular automated backups, geographically distributed data storage, point-in-time recovery options, and disaster recovery plans to ensure data integrity and availability."
